{
	"$id": "https://w3id.org/openebench/scientific-schemas/2.0/ParticipantTeam",
	"$schema": "https://json-schema.org/draft/2019-09/schema",
	"title": "A team participating of one or more challenges concept (OpenEBench Benchmarking Data Model schemas 2.0)",
	"$comment": "allOf and placeholders inspired by https://stackoverflow.com/a/24365393",
	"allOf": [
		{
			"$comment": "It declares __canonical_id__, _metadata, __revision__, __license__",
			"$ref": "_shared#/definitions/CommonKeys"
		},
		{
			"$comment": "Declaration of orig_id",
			"$ref": "_shared#/definitions/OrigIdProp"
		},
		{
			"$comment": "Declaration of references",
			"$ref": "_shared#/definitions/ReferencesProp"
		},
		{
			"$comment": "Declaration of links",
			"$ref": "_shared#/definitions/LinksProp"
		},
		{
			"$comment": "Declarations of name, description",
			"$ref": "_shared#/definitions/NameDescProp"
		}
	],
	"type": "object",
	"properties": {
		"_id": {
			"title": "The unique id of the participant team, according to the rules",
			"type": "string",
			"oneOf": [
				{
					"$ref": "_shared#/definitions/OriginalIdOnSub"
				},
				{
					"$ref": "_shared#/definitions/ParticipantTeamTemporaryId"
				},
				{
					"$ref": "_shared#/definitions/ParticipantTeamId"
				}
			]
		},
		"_schema": {
			"title": "The JSON schema absolute URI. It must match the value of '$id' in the JSON schema",
			"type": "string",
			"format": "uri",
			"enum": [ "https://w3id.org/openebench/scientific-schemas/2.0/ParticipantTeam" ]
		},
		
		"orig_id": {
			"$comment": "Placeholder covered by _shared#/definitions/OrigIdProp",
			"title": "The participant team original id"
		},
		
		"references": {
			"$comment": "Placeholder covered by _shared#/definitions/ReferencesProp",
			"title": "The participant team reference id(s) (if any)"
		},
		
		"links": {
			"$comment": "Placeholder covered by _shared#/definitions/LinksProp",
			"title": "Ways to contact the participant team responsible. It can be many different ones: public page, a social media link, some public chat, a public mailing list, ..."
		},
		
		"name": {
			"$comment": "Placeholder covered by _shared#/definitions/NameDescProp",
			"title": "Short participant team name (only valid within the scope of the benchmarking event)"
		},
		"description": {
			"$comment": "Placeholder covered by _shared#/definitions/NameDescProp",
			"title": "Optional, long description of the participant team, written in Markdown"
		},
		
		"benchmarking_event_id": {
			"title": "The parent benchmarking event where all the challenges where the team is going to participate",
			"minLength": 1,
			"type": "string",
			"foreign_keys": [
				{
					"schema_id": "BenchmarkingEvent",
					"members": [ "." ]
				}
			]
		},
		"enrolled_challenge_ids": {
			"description": "The challenges where this time has been enrolled",
			"type": "array",
			"minItems": 1,
			"uniqueItems": true,
			"items": {
				"minLength": 1,
				"type": "string",
				"foreign_keys": [
					{
						"schema_id": "Challenge",
						"members": [ "." ]
					}
				]
			}
		},
		"tool_id": {
			"title": "The id of the tool used by the participants. It is optional (only required for engagement level 3), because there could be teams without their own public tools/implementations",
			"type": "string",
			"foreign_keys": [
				{
					"schema_id": "Tool",
					"members": [ "." ]
				}
			],
			"minLength": 1
		},
		"team_members": {
			"title": "The members of the team, along their role(s)",
			"$ref": "_shared#/definitions/AuthorContactIds"
		},
		"team_manager_ids": {
			"title": "The managers of this team",
			"$ref": "_shared#/definitions/ReferredContactIds"
		}
	},
	"unevaluatedProperties": false,
	"required": [
		"_id",
		"_schema",
		"name",
		"benchmarking_event_id",
		"enrolled_challenge_ids",
		"team_members",
		"team_manager_ids"
	],
	"primary_key": ["_id"],
	"join_keys": [
		{
			"schema_id": "Challenge",
			"members": ["enrolled_challenge_ids", "benchmarking_event_id"],
			"refers_to": "BEChallengeIndex"
		}
	],
	"dependencies": {}
}
